{
  "schema_version": "0.1-draft",
  "kind": "orderable-device",
  "id": "ch32m030c8u7",
  "identity": {
    "manufacturer": "WCH",
    "part_number": "CH32M030C8U7",
    "series": "CH32M030"
  },
  "cpu": {
    "cores": [
      {
        "id": "main",
        "vendor_core": "QingKe RISC-V3B",
        "isa_claim": "RV32IMCB",
        "clock_profiles": [{ "name": "datasheet-maximum", "frequency_hz": 72000000 }],
        "role": "primary"
      }
    ],
    "evidence": [{ "source": "ds-en", "locator": "Features; Section 1.4.1 QingKe RISC-V3B processor" }]
  },
  "memory": {
    "regions": [
      { "id": "code-flash", "kind": "code-flash", "size_bytes": 65536, "attributes": ["ecc"] },
      { "id": "sram", "kind": "sram", "size_bytes": 12288 }
    ],
    "evidence": [{ "source": "ds-en", "locator": "Product resource comparison table, C8U7 column" }]
  },
  "package": {
    "name": "QFN48",
    "pin_count": 48,
    "gpio_count": 36,
    "body": "5 x 5 mm, 0.35 mm pitch",
    "temperature_grade": "industrial -40 C to 105 C",
    "special_io_counts": [
      { "kind": "medium-voltage-pre-drive", "count": 8 },
      { "kind": "high-voltage-io", "count": 1 }
    ],
    "evidence": [{ "source": "ds-en", "locator": "Product resource comparison table, C8U7 column; Chapter 4 Packages" }]
  },
  "peripherals": [
    { "kind": "half-bridge-gate-driver", "instances": 4, "evidence": [{ "source": "ds-en", "locator": "Product resource comparison table" }] },
    { "kind": "opa", "instances": 4, "evidence": [{ "source": "ds-en", "locator": "Product resource comparison table" }] },
    { "kind": "comparator", "instances": 3, "evidence": [{ "source": "ds-en", "locator": "Product resource comparison table" }] },
    { "kind": "usbfs", "instances": 1, "features": ["host", "device"], "evidence": [{ "source": "ds-en", "locator": "Product resource comparison table" }] },
    { "kind": "usbpd", "instances": 2, "features": ["CC1R", "CC2R", "CC3", "CC4"], "evidence": [{ "source": "ds-en", "locator": "Product resource comparison table, C8U7 column" }] },
    { "kind": "adc", "instances": 1, "channels": [{ "kind": "external", "count": 20 }], "evidence": [{ "source": "ds-en", "locator": "Product resource comparison table" }] }
  ],
  "pins": [],
  "sources": [
    {
      "id": "ds-en",
      "kind": "datasheet",
      "title": "CH32M030 Datasheet",
      "language": "en",
      "document_version": "V1.2",
      "url": "https://www.wch-ic.com/download/file?id=408",
      "sha256": "aa4331e7649686faf4edcc36024f01f67938594aeb3ae8de6f5d702461f7394c",
      "hash_scope": "download-artifact",
      "mirror": {
        "repository": "https://github.com/ch32-riscv-ug/CH32M030.git",
        "commit": "4c42f7407c06e099de134880e29598b7cec3966e",
        "path": "datasheet_en/CH32M030DS0.PDF"
      }
    }
  ],
  "integrated_components": [
    {
      "id": "cc1-rd",
      "kind": "resistor",
      "pads": ["PA0", "CC1R"],
      "resistance_ohms": 5100,
      "control": "software-controlled",
      "notes": "Controllable Type-C Rd pull-down; datasheet value is approximate.",
      "evidence": [{ "source": "ds-en", "locator": "Product resource comparison table note 1" }]
    },
    {
      "id": "cc2-rd",
      "kind": "resistor",
      "pads": ["PA1", "CC2R"],
      "resistance_ohms": 5100,
      "control": "software-controlled",
      "notes": "Controllable Type-C Rd pull-down; datasheet value is approximate.",
      "evidence": [{ "source": "ds-en", "locator": "Product resource comparison table note 1" }]
    }
  ],
  "coverage": {
    "identity": "complete",
    "cpu": "complete",
    "memory": "complete",
    "package": "complete",
    "peripherals": "partial",
    "package_pins": "not-started",
    "pin_functions": "not-started"
  },
  "verification": {
    "identity": "single-source",
    "cpu": "single-source",
    "memory": "single-source",
    "package": "single-source",
    "peripherals": "single-source",
    "package_pins": "not-verified",
    "pin_functions": "not-verified"
  },
  "notes": [
    "This record exists to exercise exact-SKU differences in MV/HV I/O and integrated Type-C Rd representation.",
    "Package pin bond-out has not yet been captured."
  ]
}
