{
  "schema_version": "0.1-draft",
  "kind": "orderable-device",
  "id": "ch32v006k8u7",
  "identity": {
    "manufacturer": "WCH",
    "part_number": "CH32V006K8U7",
    "series": "CH32V006"
  },
  "cpu": {
    "cores": [
      {
        "id": "main",
        "vendor_core": "QingKe RISC-V2C",
        "isa_claim": "RV32EmC",
        "clock_profiles": [{ "name": "datasheet-maximum", "frequency_hz": 48000000 }],
        "role": "primary"
      }
    ],
    "evidence": [{ "source": "ds-en", "locator": "Features; processor functional description" }]
  },
  "memory": {
    "regions": [
      { "id": "code-flash", "kind": "code-flash", "size_bytes": 63488 },
      { "id": "sram", "kind": "sram", "size_bytes": 8192 }
    ],
    "evidence": [{ "source": "ds-en", "locator": "CH32V006/005 product comparison table, CH32V006K8U7 row" }]
  },
  "package": {
    "name": "QFN32",
    "pin_count": 32,
    "gpio_count": 31,
    "temperature_grade": "industrial -40 C to 105 C",
    "evidence": [{ "source": "ds-en", "locator": "CH32V006/005 product comparison table, CH32V006K8U7 row" }]
  },
  "peripherals": [
    { "kind": "adc", "instances": 1, "channels": [{ "kind": "external", "count": 8 }, { "kind": "internal", "count": 2 }], "evidence": [{ "source": "ds-en", "locator": "Product comparison table" }] },
    { "kind": "opa", "instances": 1, "evidence": [{ "source": "ds-en", "locator": "Product comparison table" }] },
    { "kind": "usart", "instances": 2, "evidence": [{ "source": "ds-en", "locator": "Product comparison table" }] },
    { "kind": "spi", "instances": 1, "evidence": [{ "source": "ds-en", "locator": "Product comparison table" }] },
    { "kind": "i2c", "instances": 1, "evidence": [{ "source": "ds-en", "locator": "Product comparison table" }] }
  ],
  "pins": [],
  "sources": [
    {
      "id": "ds-en",
      "kind": "datasheet",
      "title": "CH32V006/005 Datasheet",
      "language": "en",
      "document_version": "V2.0",
      "url": "https://www.wch-ic.com/download/file?id=396",
      "sha256": "806ff03d11ebe8f522b6a10bfce20040f30f3cff6a751bd982efca788f9601f2",
      "hash_scope": "download-artifact",
      "mirror": {
        "repository": "https://github.com/ch32-riscv-ug/CH32V006.git",
        "commit": "ef85b258ea5676e3a58978e2b40a5b398933dd07",
        "path": "datasheet_en/CH32V006DS0.PDF"
      }
    }
  ],
  "coverage": {
    "identity": "complete",
    "cpu": "complete",
    "memory": "complete",
    "package": "complete",
    "peripherals": "partial",
    "package_pins": "not-started",
    "pin_functions": "not-started"
  },
  "verification": {
    "identity": "single-source",
    "cpu": "single-source",
    "memory": "single-source",
    "package": "single-source",
    "peripherals": "single-source",
    "package_pins": "not-verified",
    "pin_functions": "not-verified"
  },
  "notes": ["62K is represented as 62 * 1024 bytes; linker-usable boundaries remain to be checked against the reference manual."]
}
